<?xml version="1.0" encoding="UTF-8"?>
<!DOCTYPE dcm4jboss-attribute-filter SYSTEM "dcm4jboss-attribute-filter.dtd">
<dcm4jboss-attribute-filter>
  <filter level="PATIENT">
<!-- Specific Character Set -->
    <attr tag="(0008,0005)"/>
<!-- Patient's Name -->
    <attr tag="(0010,0010)"/>
<!-- Patient ID -->
    <attr tag="(0010,0020)"/>
<!-- Issuer of Patient ID -->
    <attr tag="(0010,0021)"/>
<!-- Patient's Birth Date -->
    <attr tag="(0010,0030)"/>
<!-- Patient's Sex -->
    <attr tag="(0010,0040)"/>
  </filter>
  
  <filter level="STUDY">
<!-- Specific Character Set -->
    <attr tag="(0008,0005)"/>
<!-- Study Date -->
    <attr tag="(0008,0020)"/>
<!-- Study Time -->
    <attr tag="(0008,0030)"/>
<!-- Accession Number -->
    <attr tag="(0008,0050)"/>
<!-- Referring Physician Name -->
    <attr tag="(0008,0090)"/>
<!-- Study Description -->
    <attr tag="(0008,1030)"/>
<!-- Procedure Code Seq -->
    <attr tag="(0008,1032)"/>
<!-- Study Instance UID -->
    <attr tag="(0020,000D)"/>
<!-- Study ID -->
    <attr tag="(0020,0010)"/>
  </filter>
  
  <filter level="SERIES">
<!-- Specific Character Set -->
    <attr tag="(0008,0005)"/>
<!-- Series Date -->
    <attr tag="(0008,0021)"/>
<!-- Series Time -->
    <attr tag="(0008,0031)"/>
<!-- Modality -->
    <attr tag="(0008,0060)"/>
<!-- Manufacturer -->
    <attr tag="(0008,0070)"/>
<!-- Series Description -->
    <attr tag="(0008,103E)"/>
<!-- Manufacturer Model Name -->
    <attr tag="(0008,1090)"/>
<!-- Referenced Performed Procedure Step Sequence -->
    <attr tag="(0008,1111)"/>
<!-- Body Part Examined -->
    <attr tag="(0018,0015)"/>
<!-- Series Instance UID -->
    <attr tag="(0020,000E)"/>
<!-- Series Number -->
    <attr tag="(0020,0011)"/>
<!-- Laterality -->
    <attr tag="(0020,0060)"/>
<!-- Performed Procedure Step Start Date -->
    <attr tag="(0040,0244)"/>
<!-- Performed Procedure Step Start Time -->
    <attr tag="(0040,0245)"/>
<!-- Request Attributes Sequence -->
    <attr tag="(0040,0275)"/>
  </filter>
  
  <filter level="IMAGE" exclude="true">
<!-- Patient Attributes -->
<!-- Patient's Name -->
    <attr tag="(0010,0010)"/>
<!-- Patient ID -->
    <attr tag="(0010,0020)"/>
<!-- Issuer of Patient ID -->
    <attr tag="(0010,0021)"/>
<!-- Patient's Birth Date -->
    <attr tag="(0010,0030)"/>
<!-- Patient's Sex -->
    <attr tag="(0010,0040)"/>

<!-- Study Attributes -->
<!-- Study Date -->
    <attr tag="(0008,0020)"/>
<!-- Study Time -->
    <attr tag="(0008,0030)"/>
<!-- Accession Number -->
    <attr tag="(0008,0050)"/>
<!-- Referring Physician Name -->
    <attr tag="(0008,0090)"/>
<!-- Study Description -->
    <attr tag="(0008,1030)"/>
<!-- Procedure Code Seq -->
    <attr tag="(0008,1032)"/>
<!-- Study Instance UID -->
    <attr tag="(0020,000D)"/>
<!-- Study ID -->
    <attr tag="(0020,0010)"/>

<!-- Series Attributes -->
<!-- Series Date -->
    <attr tag="(0008,0021)"/>
<!-- Series Time -->
    <attr tag="(0008,0031)"/>
<!-- Modality -->
    <attr tag="(0008,0060)"/>
<!-- Manufacturer -->
    <attr tag="(0008,0070)"/>
<!-- Series Description -->
    <attr tag="(0008,103E)"/>
<!-- Manufacturer Model Name -->
    <attr tag="(0008,1090)"/>
<!-- Referenced Performed Procedure Step Sequence -->
    <attr tag="(0008,1111)"/>
<!-- Body Part Examined -->
    <attr tag="(0018,0015)"/>
<!-- Series Instance UID -->
    <attr tag="(0020,000E)"/>
<!-- Series Number -->
    <attr tag="(0020,0011)"/>
<!-- Laterality -->
    <attr tag="(0020,0060)"/>
<!-- Performed Procedure Step Start Date -->
    <attr tag="(0040,0244)"/>
<!-- Performed Procedure Step Start Time -->
    <attr tag="(0040,0245)"/>
<!-- Request Attributes Sequence -->
    <attr tag="(0040,0275)"/>
    
<!-- Instance Attributes -->
<!-- Content Sequence -->
    <attr tag="(0040,A730)"/>
    
  </filter>
  
</dcm4jboss-attribute-filter>
